front,back,id,type,tier,hint,rule_ref
the paradigm,el paradigma,L44-003,transformation,primary,-ma → masc (Greek),L44#2
the diagram,el diagrama,L44-004,transformation,primary,-ma → masc (Greek),L44#2
the outline / scheme,el esquema,L44-005,transformation,primary,e- added: Spanish can't start s+consonant,"L44#2, L44#3"
the planet,el planeta,L44-006,transformation,primary,masc even though -a,L44#4
the planets,los planetas,L44-007,transformation,primary,still masc in plural,L44#4
the hand,la mano,L44-009,transformation,primary,fem despite -o (man- = hand),"L44#9, L44#10"
the hands,las manos,L44-010,transformation,primary,still fem in plural,L44#9
the photo,la foto,L44-011,transformation,primary,short for la fotografía → fem,L44#11
the motorbike,la moto,L44-012,transformation,primary,short for la motocicleta → fem,L44#11
the camera,la cámara,L44-014,transformation,primary,fem -a — accent on cá,L44#19
this car,este auto,L44-015,transformation,primary,este = this (masc),"L44#6, L44#5"
that car,ese auto,L44-016,transformation,primary,drop t from este → ese = that,L44#7
that night,esa noche,L44-018,transformation,primary,esta → esa (drop t),L44#7
these hands,estas manos,L44-019,transformation,primary,fem plural — mano is fem!,"L44#8, L44#9"
those nights,esas noches,L44-020,transformation,primary,esos/esas = those,L44#8
this hand,esta mano,L44-021,transformation,primary,fem — esta (not este) even though -o,"L44#9, L44#6"
to handle / manage / drive,manejar,L44-023,transformation,primary,from mano — handling horses,L44#10
to take,tomar,L44-025,transformation,primary,used for photos: tomar una foto,L44#12
to take (out / a photo),sacar,L44-026,transformation,primary,*sacar una foto* = take a photo,L44#13
I want that car.,Quiero ese auto.,L44-028,sentence,primary,,"L44#7, L44#5"
I don't want that car.,No quiero ese auto.,L44-030,sentence,primary,,L44#7
It's very big.,Es muy grande.,L44-031,sentence,primary,muy + grande,L44#19
Can you give me a hand?,¿Me puedes dar una mano?,L44-033,sentence,primary,una (fem) because mano is fem,"L44#16, L44#9"
Could you give me a hand?,¿Me podrías dar una mano?,L44-034,sentence,primary,podrías = could you (informal),L44#17
They should give me a hand.,Deberían darme una mano.,L44-036,sentence,primary,darme = pronoun on the 'to' form,L44#18
They should give us a hand.,Nos deberían dar una mano.,L44-037,sentence,primary,,L44#18
I manage the problem.,Manejo el problema.,L44-038,sentence,primary,el problema (masc!),"L44#14, L44#2"
I'm taking a photo.,Estoy tomando una foto.,L44-040,sentence,primary,una (fem) — foto is fem,"L44#12, L44#15"
I would like to take a photo.,Me gustaría tomar una foto.,L44-042,sentence,primary,,L44#20
But I don't have my camera.,Pero no tengo mi cámara.,L44-043,sentence,primary,pero = but,L44#19
this problem,este problema,L44-047,transformation,extended,masc — este (not esta),"L44#6, L44#2"
that system,ese sistema,L44-048,transformation,extended,masc — ese (not esa),"L44#7, L44#2"
This problem is very big.,Este problema es muy grande.,L44-049,sentence,extended,este (masc) — problema is masc,"L44#6, L44#2"
I'm taking a photo of the planet.,Estoy tomando una foto del planeta.,L44-050,sentence,extended,de + el → del,"L44#12, L44#4"
I'd like to take a photo tonight.,Me gustaría tomar una foto esta noche.,L44-051,sentence,extended,,"L44#20, L44#6"
Could you give us a hand tonight?,¿Nos podrías dar una mano esta noche?,L44-052,sentence,extended,,"L44#17, L44#6"
"I don't want that car, it's too big.","No quiero ese auto, es muy grande.",L44-053,sentence,extended,,"L44#7, L44#19"
to interest / to be interesting to,interesar,L45-001,transformation,primary,-ar verb · flips like gustar,L45#4
interesting,interesante,L45-002,transformation,primary,-ante adjective,L45#4
to seem,parecer,L45-003,transformation,primary,-er verb! (not -ar),"L45#10, L45#11"
to put,poner,L45-004,transformation,primary,-er verb · also covers -pose,L45#18
salt,sal,L45-007,transformation,primary,feminine (la sal),L45#22
It interests me.,Me interesa.,L45-015,sentence,primary,,"L45#5, L45#4"
Does it interest you?,¿Te interesa?,L45-017,sentence,primary,,L45#6
Why doesn't it interest you?,¿Por qué no te interesa?,L45-019,sentence,primary,"por qué (two words, accent) = why","L45#6, L45#14"
It interests him.,Le interesa.,L45-020,sentence,primary,le (not lo) with gustar-family,"L45#3, L45#5"
It would interest you.,Te interesaría.,L45-022,sentence,primary,-aría conditional,L45#9
It would interest me to see it.,Me interesaría verlo.,L45-023,sentence,primary,,"L45#9, L45#17"
Does it interest you to dance tonight?,¿Te interesa bailar esta noche?,L45-024,sentence,primary,,"L45#7, L45#6"
It seems to me.,Me parece.,L45-025,sentence,primary,,L45#10
It seems to me that...,Me parece que...,L45-026,sentence,primary,que is obligatory in Spanish,L45#12
Seems fine to me.,Me parece bien.,L45-027,sentence,primary,"bien (well), not bueno",L45#15
It doesn't seem right to me.,No me parece bien.,L45-028,sentence,primary,,L45#16
Doesn't it seem right to you?,¿No le parece bien?,L45-030,sentence,primary,le = formal you,L45#16
It seems he doesn't like it.,Me parece que no le gusta.,L45-031,sentence,primary,,"L45#12, L45#2"
It seems he doesn't want to go out tonight.,Parece que no quiere salir esta noche.,L45-032,sentence,primary,,"L45#12, L45#8"
It interests them to go out.,Les interesa salir.,L45-033,sentence,primary,,"L45#5, L45#8"
Would it interest you to go out?,¿Te interesaría salir?,L45-034,sentence,primary,,"L45#9, L45#8"
I want to put it here.,Quiero ponerlo aquí.,L45-035,sentence,primary,-lo on the 'to' form,L45#20
I want to put salt on it.,Quiero ponerle sal.,L45-037,sentence,primary,le = on it (not lo),L45#21
I'd like to put a little more salt.,Me gustaría ponerle un poco más sal.,L45-039,sentence,primary,,L45#23
I'd like to put a little more salt on them.,Me gustaría ponerles un poco más sal.,L45-040,sentence,primary,-les for plural (on them),L45#24
Could you put it here?,¿Podrías ponerlo aquí?,L45-041,sentence,primary,,L45#20
I want to compose.,Quiero componer.,L45-042,sentence,primary,,"L45#18, L45#19"
Does it interest her to go out to dance tonight?,¿Le interesa salir a bailar esta noche?,L45-045,sentence,extended,,L45#8
It seems good to me. (Me parece bueno),Me parece bueno.,L45-047,sentence,extended,"bueno here, contrast to bien",L45#15
I suppose it interests him.,Supongo que le interesa.,L45-049,sentence,extended,,"L45#18, L45#5"
I'd like to put more salt here.,Me gustaría ponerle más sal aquí.,L45-050,sentence,extended,,"L45#21, L45#20"
It doesn't interest them at all.,No les interesa nada.,L45-051,sentence,extended,nada = nothing/at all,L45#5
Why doesn't it seem right to him?,¿Por qué no le parece bien?,L45-054,sentence,extended,,"L45#16, L45#14"
eaten (participle),comido,L46-006,transformation,primary,-er → -ido,L46#3
spoken (participle),hablado,L46-007,transformation,primary,-ar → -ado,L46#3
been able (participle),podido,L46-009,transformation,primary,-er → -ido,L46#3
I would have (haber in would-time),habría,L46-011,transformation,primary,habería → habría (e drops),L46#6
I have eaten.,He comido.,L46-015,sentence,primary,,"L46#2, L46#3"
They have danced.,Han bailado.,L46-017,sentence,primary,,"L46#2, L46#4"
I have been able to eat.,He podido comer.,L46-019,sentence,primary,second verb stays 'to' form,L46#3
I haven't been able to eat.,No he podido comer.,L46-020,sentence,primary,,L46#8
You have eaten.,Has comido.,L46-022,sentence,primary,informal you,L46#2
I would have gone out.,Habría salido.,L46-023,sentence,primary,habría + salido (chunks),"L46#6, L46#7"
I would have been able to go out.,Habría podido salir.,L46-024,sentence,primary,,L46#6
I wouldn't have been able to go out.,No habría podido salir.,L46-025,sentence,primary,,L46#8
We would have danced.,Habríamos bailado.,L46-027,sentence,primary,,L46#6
I/he was speaking (line past),hablaba,L46-029,transformation,primary,-ar → -aba (covers I/he/she/usted),"L46#9, L46#11"
you (informal) were speaking,hablabas,L46-030,transformation,primary,-abas,L46#10
we were speaking,hablábamos,L46-032,transformation,primary,-ábamos (accent stays on -aba),L46#10
I/he was waiting,esperaba,L46-033,transformation,primary,-ar → -aba,L46#9
I/he was trying,intentaba,L46-034,transformation,primary,,L46#9
I used to speak.,Hablaba.,L46-035,sentence,primary,line past = used to / was -ing,L46#11
We were speaking.,Hablábamos.,L46-036,sentence,primary,,L46#10
I was waiting for you.,Te esperaba.,L46-037,sentence,primary,informal you · drop 'for',L46#12
I was waiting for him.,Lo esperaba.,L46-038,sentence,primary,lo = him / formal you (masc),L46#13
I was waiting for her.,La esperaba.,L46-039,sentence,primary,la = her / formal you (fem),L46#13
We were waiting for him.,Lo esperábamos.,L46-040,sentence,primary,,"L46#10, L46#13"
We were waiting for them.,Los esperábamos.,L46-041,sentence,primary,,"L46#10, L46#13"
I was trying.,Intentaba.,L46-042,sentence,primary,,L46#9
They were trying to find it for me. (encontrármelo),Intentaban encontrármelo.,L46-044,sentence,primary,"me + lo stacked: me first, lo second",L46#14
they were trying,intentaban,L46-051,transformation,extended,,L46#10
You haven't spoken.,No has hablado.,L46-055,sentence,extended,,L46#8
He used to dance every day.,Bailaba todos los días.,L46-059,sentence,extended,line past = habitual,L46#11
I used to wait here.,Esperaba aquí.,L46-060,sentence,extended,,L46#11
We were waiting for you guys.,Los esperábamos.,L46-061,sentence,extended,los covers you-guys / them,L46#13
They were trying to find it for me. (para mí),Intentaban encontrarlo para mí.,L46-062,sentence,extended,emphatic form with para mí,L46#15
I haven't been able to find it.,No he podido encontrarlo.,L46-068,sentence,extended,,L46#8
I was managing the problem.,Manejaba el problema.,L46-070,sentence,extended,line past + masc -ma noun,"L46#9, L44#2"
It interested me.,Me interesaba.,L46-073,sentence,extended,line past of interesar,"L46#9, L45#5"
